conceptType,conceptUri,skillType,reuseLevel,preferredLabel,altLabels,description,broaderConceptUri,broaderConceptPT
KnowledgeSkillCompetence,http://data.europa.eu/esco/skill/14832d87-2f2f-4895-b290-e4760ebae42a,skill/competence,transversal,solve technical problems,,"Identify technical problems when operating devices and using digital environments, and solve them (from trouble-shooting to solving more complex problems).",http://data.europa.eu/esco/skill/7e5147d1-60b1-4a68-804b-1f5cb0396b91,problem-solving with digital tools
KnowledgeSkillCompetence,http://data.europa.eu/esco/skill/16a00c69-9c74-4c37-96d7-6301d285e5ce,skill/competence,transversal,engage in citizenship through digital technologies,apply e-services | use e-services | able to use e-services | utilise e-services | make use of e-services | use online payment solutions | using e-services,Participate in society through the use of public and private digital services. Seek opportunities for self-empowerment and for participatory citizenship through appropriate digital technologies.,http://data.europa.eu/esco/skill/574257ea-7b64-4100-b7b6-e27c233fe143,digital communication and collaboration
KnowledgeSkillCompetence,http://data.europa.eu/esco/skill/1a4cc54f-1e53-442b-a6d2-1682dc8ef8f9,skill/competence,transversal,creatively use digital technologies,,Use digital tools and technologies to create knowledge and to innovate processes and products. Engage individually and collectively in cognitive processing to understand and resolve conceptual problems and problem situations in digital environments.,http://data.europa.eu/esco/skill/7e5147d1-60b1-4a68-804b-1f5cb0396b91,problem-solving with digital tools
KnowledgeSkillCompetence,http://data.europa.eu/esco/skill/1d6c7de4-350e-4868-a47b-333b4b0d9650,skill/competence,transversal,"evaluate data, information and digital content",,"Analyse, compare and critically evaluate the credibility and reliability of sources of data, information and digital content. Analyse, interpret and critically evaluate the data, information and digital content.",http://data.europa.eu/esco/skill/629685b8-5f9e-4522-8cff-b3e2c4ec625a,digital data processing
KnowledgeSkillCompetence,http://data.europa.eu/esco/skill/21d2f96d-35f7-4e3f-9745-c533d2dd6e97,knowledge,transversal,computer programming,,"The techniques and principles of software development, such as analysis, algorithms, coding, testing and compiling of programming paradigms (e.g. object oriented programming, functional programming) and of programming languages.",http://data.europa.eu/esco/skill/f5369f2f-e52b-43d8-8d31-79a6c11188d8,digital content creation
KnowledgeSkillCompetence,http://data.europa.eu/esco/skill/238343b1-7b51-42b3-a9ed-cf24d3a236e7,skill/competence,transversal,identify digital competence gaps,,Understand where one’s own digital competence needs to be improved or updated. Be able to support others with their digital competence development. Seek opportunities for self-development and keep up-to-date with the digital evolution.,http://data.europa.eu/esco/skill/7e5147d1-60b1-4a68-804b-1f5cb0396b91,problem-solving with digital tools
KnowledgeSkillCompetence,http://data.europa.eu/esco/skill/2b34a99f-9813-4c91-9509-b6b9b8c3132e,skill/competence,transversal,collaborate through digital technologies,able to use online tools to collaborate | utilise online tools to collaborate | use online tools to collaborate | make use of online tools to collaborate | use VoIP conference calling | use online meeting tools | use concurrent file editing | apply online tools to collaborate | using online tools to collaborate,"Use digital tools and technologies for collaborative processes, and for co-construction and co-creation of resources and knowledge.",http://data.europa.eu/esco/skill/574257ea-7b64-4100-b7b6-e27c233fe143,digital communication and collaboration
KnowledgeSkillCompetence,http://data.europa.eu/esco/skill/33a82b83-c838-4889-ae62-fae1317481eb,skill/competence,transversal,protect personal data and privacy,protect online privacy and identity | safeguarding online privacy and identity | safeguard online privacy and identities | protect digital identity | protect digital privacy | keep online privacy and identity secure | safeguard online privacy and identity | review online privacy settings | take action to ensure online privacy | defend online privacy and identity | safeguard online identity and privacy,Protect personal data and privacy in digital environments. Understand how to use and share personally identifiable information while being able to protect oneself and others from damages. Understand that digital services use a “Privacy policy” to inform how personal data is used.,http://data.europa.eu/esco/skill/426ceaba-6867-481c-bb6b-aee3933da7d2,ICT safety
KnowledgeSkillCompetence,http://data.europa.eu/esco/skill/40001d93-8937-4859-89d5-2dca53290ff4,skill/competence,transversal,share through digital technologies,,"Share data, information and digital content with others through appropriate digital technologies. Act as an intermediary, know about referencing and attribution practices.",http://data.europa.eu/esco/skill/574257ea-7b64-4100-b7b6-e27c233fe143,digital communication and collaboration
KnowledgeSkillCompetence,http://data.europa.eu/esco/skill/42fcf80d-7b45-40f3-bd2f-5411c4c0dfa0,skill/competence,transversal,identify needs and technological responses,,"Assess needs and identify, evaluate, select and use digital tools and possible technological responses to solve them. Adjust and customise digital environments to personal needs (e.g. accessibility).",http://data.europa.eu/esco/skill/7e5147d1-60b1-4a68-804b-1f5cb0396b91,problem-solving with digital tools
KnowledgeSkillCompetence,http://data.europa.eu/esco/skill/4d97e3c3-f335-47cc-a4ee-0d779fd42222,skill/competence,transversal,"manage data, information and digital content",,"Organise, store and retrieve data, information and content in digital environments. Organise and process them in a structured environment.",http://data.europa.eu/esco/skill/629685b8-5f9e-4522-8cff-b3e2c4ec625a,digital data processing
KnowledgeSkillCompetence,http://data.europa.eu/esco/skill/5af49836-2269-46d9-87b9-0d3140c6c22e,skill/competence,transversal,integrate and re-elaborate digital content,,"Modify, refine, improve and integrate information and content into an existing body of knowledge to create new, original and relevant content and knowledge.",http://data.europa.eu/esco/skill/f5369f2f-e52b-43d8-8d31-79a6c11188d8,digital content creation
KnowledgeSkillCompetence,http://data.europa.eu/esco/skill/5fd5c985-eaaa-47aa-8314-62359c54505a,skill/competence,transversal,develop digital content,,"Create and edit digital content in different formats, express oneself through digital means.",http://data.europa.eu/esco/skill/f5369f2f-e52b-43d8-8d31-79a6c11188d8,digital content creation
KnowledgeSkillCompetence,http://data.europa.eu/esco/skill/97c1895a-a890-47da-abfc-79dc272add2e,skill/competence,transversal,use online conventions of netiquette,observe netiquette | able to use online conventions of netiquette | apply online conventions of netiquette | make use of online conventions of netiquette | utilise online conventions of netiquette | using online conventions of netiquette,Apply behavioural norms and know-how while using digital technologies and interacting in digital environments. Adapt communication strategies to the specific audience and be aware of cultural and generational diversity in digital environments.,http://data.europa.eu/esco/skill/574257ea-7b64-4100-b7b6-e27c233fe143,digital communication and collaboration
KnowledgeSkillCompetence,http://data.europa.eu/esco/skill/a12057b4-6d11-4a12-ab8e-15a028ef0a6d,skill/competence,transversal,interact through digital technologies,use e-mail software and services | utilise online communication tools | able to use online communication tools | using online communication tools | communicate on-line | make use of online communication tools | apply online communication tools | communicate in digital environments | use online communication tools | interact through ICT,Interact through a variety of digital technologies and understand appropriate digital communication means for a given context.,http://data.europa.eu/esco/skill/574257ea-7b64-4100-b7b6-e27c233fe143,digital communication and collaboration
KnowledgeSkillCompetence,http://data.europa.eu/esco/skill/a91732ce-988e-4105-9570-f425c6ffdc82,knowledge,transversal,copyright and licenses related to digital content,,"Understand how copyright and licences apply to data, information and digital content.",http://data.europa.eu/esco/skill/f5369f2f-e52b-43d8-8d31-79a6c11188d8,digital content creation
KnowledgeSkillCompetence,http://data.europa.eu/esco/skill/bc0b0b5d-f6be-405a-b224-b6902a4dbe97,skill/competence,transversal,manage digital identity,,"Create and manage one or multiple digital identities, be able to protect one's own reputation, deal with the data that one produces through several digital tools, environments and services.",http://data.europa.eu/esco/skill/574257ea-7b64-4100-b7b6-e27c233fe143,digital communication and collaboration
KnowledgeSkillCompetence,http://data.europa.eu/esco/skill/c4ba12d1-4698-42fa-8abb-789462ea2586,skill/competence,transversal,protect the environment from the impact of the digital technologies,,Be aware of the environmental impact of digital technologies and their use.,http://data.europa.eu/esco/skill/426ceaba-6867-481c-bb6b-aee3933da7d2,ICT safety
KnowledgeSkillCompetence,http://data.europa.eu/esco/skill/d1ed5b3a-cab5-4c5d-baf8-0214998b58fb,skill/competence,transversal,protect health and well-being while using digital technologies,,Be able to avoid health-risks and threats to physical and psychological well-being while using digital technologies. Be able to protect oneself and others from possible dangers in digital environments (e.g. cyber bullying). Be aware of digital technologies for social well-being and social inclusion.,http://data.europa.eu/esco/skill/426ceaba-6867-481c-bb6b-aee3933da7d2,ICT safety
KnowledgeSkillCompetence,http://data.europa.eu/esco/skill/df329d70-87b0-466b-a214-3431f36e2a5e,skill/competence,transversal,protect ICT devices,take care of ICT devices | use anti-virus software | keep ICT devices safe | protect information and communication technologies devices | set up passwords and private settings | protect personal data | protect ICT device | up-date online security measures | safeguard ICT devices | implement private ICT user security measures,"Protect devices and digital content, and understand risks and threats in digital environments. Know about safety and security measures and have due regard to reliability and privacy. Make use of tools and methods which maximise security of ICT devices and information by controlling access, such as passwords, digital signatures, biometry, and protecting systems such as firewall, antivirus, spam filters.",http://data.europa.eu/esco/skill/426ceaba-6867-481c-bb6b-aee3933da7d2,ICT safety
KnowledgeSkillCompetence,http://data.europa.eu/esco/skill/e439742d-558d-4f52-885e-afdc740b48cf,skill/competence,transversal,"browse, search and filter data, information and digital content",,"Articulate information needs, search for data, information and content in digital environments, access them and navigate between them. Create and update personal search strategies.",http://data.europa.eu/esco/skill/629685b8-5f9e-4522-8cff-b3e2c4ec625a,digital data processing
